{
  "schema_version": "0.1.0",
  "dataset_id": "lerobot/columbia_cairlab_pusht_real",
  "revision": "main",
  "scored_at": "2026-08-22T22:17:41.910265+00:00",
  "format": {
    "detected": "v3.0",
    "valid_lerobot": true,
    "robot_type": "unknown",
    "fps": 10,
    "total_episodes": 136,
    "total_frames": 27808,
    "total_tasks": 1
  },
  "sample": {
    "n_episodes": 10,
    "n_frames": 2107,
    "max_episodes": 10
  },
  "scores": {
    "overall": 84.57,
    "physical": 80.0,
    "annotation": 85.71,
    "integrity": 100.0
  },
  "band": "clean",
  "checks": [
    {
      "id": "velocity_spike",
      "category": "physical",
      "status": "pass",
      "score": 100.0,
      "summary": "0/10 episodes have velocity z > 3.5",
      "flagged_episodes": [],
      "metrics": {
        "derived_velocity": true,
        "threshold_z": 3.5
      }
    },
    {
      "id": "acceleration_spike",
      "category": "physical",
      "status": "pass",
      "score": 80.0,
      "summary": "2/10 episodes have acceleration z > 4.0",
      "flagged_episodes": [
        0,
        8
      ],
      "metrics": {
        "threshold_z": 4.0
      }
    },
    {
      "id": "torque_saturation",
      "category": "physical",
      "status": "skipped",
      "score": null,
      "summary": "no torque/effort columns",
      "flagged_episodes": [],
      "metrics": {}
    },
    {
      "id": "force_spike",
      "category": "physical",
      "status": "skipped",
      "score": null,
      "summary": "no force/wrench columns",
      "flagged_episodes": [],
      "metrics": {}
    },
    {
      "id": "repeated_action",
      "category": "physical",
      "status": "fail",
      "score": 60.0,
      "summary": "4/10 episodes repeat an action for 8+ frames",
      "flagged_episodes": [
        1,
        2,
        4,
        6
      ],
      "metrics": {
        "run_threshold": 8,
        "eps": 0.0001
      }
    },
    {
      "id": "empty_or_placeholder_task",
      "category": "annotation",
      "status": "fail",
      "score": 0.0,
      "summary": "1/1 task labels are empty or placeholders",
      "flagged_episodes": [],
      "metrics": {
        "placeholders": [
          ""
        ],
        "n_tasks": 1
      }
    },
    {
      "id": "task_coverage",
      "category": "annotation",
      "status": "pass",
      "score": 100,
      "summary": "all task_index values resolve",
      "flagged_episodes": [],
      "metrics": {
        "missing_task_index": [],
        "n_task_rows": 1
      }
    },
    {
      "id": "task_specificity",
      "category": "annotation",
      "status": "skipped",
      "score": null,
      "summary": "no task text",
      "flagged_episodes": [],
      "metrics": {}
    },
    {
      "id": "required_lerobot_fields",
      "category": "annotation",
      "status": "pass",
      "score": 100,
      "summary": "LeRobot schema looks complete",
      "flagged_episodes": [],
      "metrics": {
        "missing_info_keys": [],
        "missing_columns": [],
        "n_features": 11
      }
    },
    {
      "id": "fps_consistency",
      "category": "annotation",
      "status": "pass",
      "score": 100.0,
      "summary": "0/10 episodes disagree with declared fps=10",
      "flagged_episodes": [],
      "metrics": {
        "declared_fps": 10
      }
    },
    {
      "id": "timestamp_monotonic",
      "category": "annotation",
      "status": "pass",
      "score": 100.0,
      "summary": "0/10 episodes have non-increasing timestamps",
      "flagged_episodes": [],
      "metrics": {}
    },
    {
      "id": "episode_length_anomaly",
      "category": "annotation",
      "status": "pass",
      "score": 100.0,
      "summary": "0/10 episodes are empty, single-frame, or extreme outliers",
      "flagged_episodes": [],
      "metrics": {
        "median_length": 202.0,
        "min": 111,
        "max": 292
      }
    },
    {
      "id": "declared_video_missing",
      "category": "annotation",
      "status": "pass",
      "score": 100,
      "summary": "video shards present",
      "flagged_episodes": [],
      "metrics": {
        "n_video_features": 2,
        "n_mp4": 2,
        "video_keys": [
          "observation.images.wrist_image",
          "observation.images.image"
        ]
      }
    },
    {
      "id": "nan_inf",
      "category": "integrity",
      "status": "pass",
      "score": 100.0,
      "summary": "0/10 episodes contain NaN or Inf",
      "flagged_episodes": [],
      "metrics": {
        "columns_checked": [
          "observation.state",
          "action"
        ]
      }
    },
    {
      "id": "constant_sequence",
      "category": "integrity",
      "status": "pass",
      "score": 100.0,
      "summary": "0/10 episodes freeze a normally-variable state channel",
      "flagged_episodes": [],
      "metrics": {}
    }
  ],
  "flagged_episodes": [
    0,
    1,
    2,
    4,
    6,
    8
  ],
  "warnings": [
    "velocity_spike used finite-differenced state"
  ],
  "error": null
}