{
  "schema_version": "0.1.0",
  "dataset_id": "lerobot/umi_cup_in_the_wild",
  "revision": "main",
  "scored_at": "2026-08-22T22:32:13.822067+00:00",
  "format": {
    "detected": "v3.0",
    "valid_lerobot": true,
    "robot_type": "unknown",
    "fps": 10,
    "total_episodes": 1447,
    "total_frames": 699432,
    "total_tasks": 1
  },
  "sample": {
    "n_episodes": 10,
    "n_frames": 3955,
    "max_episodes": 10
  },
  "scores": {
    "overall": 75.25,
    "physical": 45.0,
    "annotation": 100.0,
    "integrity": 100.0
  },
  "band": "review",
  "checks": [
    {
      "id": "velocity_spike",
      "category": "physical",
      "status": "fail",
      "score": 70.0,
      "summary": "3/10 episodes have velocity z > 3.5",
      "flagged_episodes": [
        3,
        4,
        9
      ],
      "metrics": {
        "derived_velocity": true,
        "threshold_z": 3.5
      }
    },
    {
      "id": "acceleration_spike",
      "category": "physical",
      "status": "fail",
      "score": 20.0,
      "summary": "8/10 episodes have acceleration z > 4.0",
      "flagged_episodes": [
        0,
        1,
        2,
        3,
        4,
        7,
        8,
        9
      ],
      "metrics": {
        "threshold_z": 4.0
      }
    },
    {
      "id": "torque_saturation",
      "category": "physical",
      "status": "skipped",
      "score": null,
      "summary": "no torque/effort columns",
      "flagged_episodes": [],
      "metrics": {}
    },
    {
      "id": "force_spike",
      "category": "physical",
      "status": "skipped",
      "score": null,
      "summary": "no force/wrench columns",
      "flagged_episodes": [],
      "metrics": {}
    },
    {
      "id": "repeated_action",
      "category": "physical",
      "status": "skipped",
      "score": null,
      "summary": "no action column",
      "flagged_episodes": [],
      "metrics": {}
    },
    {
      "id": "empty_or_placeholder_task",
      "category": "annotation",
      "status": "pass",
      "score": 100.0,
      "summary": "0/1 task labels are empty or placeholders",
      "flagged_episodes": [],
      "metrics": {
        "placeholders": [],
        "n_tasks": 1
      }
    },
    {
      "id": "task_coverage",
      "category": "annotation",
      "status": "pass",
      "score": 100,
      "summary": "all task_index values resolve",
      "flagged_episodes": [],
      "metrics": {
        "missing_task_index": [],
        "n_task_rows": 1
      }
    },
    {
      "id": "task_specificity",
      "category": "annotation",
      "status": "pass",
      "score": 100.0,
      "summary": "1 unique task string(s); 0 shorter than 12 characters",
      "flagged_episodes": [],
      "metrics": {
        "n_unique": 1,
        "short_examples": [],
        "n_episodes": 1447
      }
    },
    {
      "id": "required_lerobot_fields",
      "category": "annotation",
      "status": "pass",
      "score": 100,
      "summary": "LeRobot schema looks complete",
      "flagged_episodes": [],
      "metrics": {
        "missing_info_keys": [],
        "missing_columns": [],
        "n_features": 12
      }
    },
    {
      "id": "fps_consistency",
      "category": "annotation",
      "status": "pass",
      "score": 100.0,
      "summary": "0/10 episodes disagree with declared fps=10",
      "flagged_episodes": [],
      "metrics": {
        "declared_fps": 10
      }
    },
    {
      "id": "timestamp_monotonic",
      "category": "annotation",
      "status": "pass",
      "score": 100.0,
      "summary": "0/10 episodes have non-increasing timestamps",
      "flagged_episodes": [],
      "metrics": {}
    },
    {
      "id": "episode_length_anomaly",
      "category": "annotation",
      "status": "pass",
      "score": 100.0,
      "summary": "0/10 episodes are empty, single-frame, or extreme outliers",
      "flagged_episodes": [],
      "metrics": {
        "median_length": 380.0,
        "min": 316,
        "max": 546
      }
    },
    {
      "id": "declared_video_missing",
      "category": "annotation",
      "status": "pass",
      "score": 100,
      "summary": "video shards present",
      "flagged_episodes": [],
      "metrics": {
        "n_video_features": 1,
        "n_mp4": 15,
        "video_keys": [
          "observation.image"
        ]
      }
    },
    {
      "id": "nan_inf",
      "category": "integrity",
      "status": "pass",
      "score": 100.0,
      "summary": "0/10 episodes contain NaN or Inf",
      "flagged_episodes": [],
      "metrics": {
        "columns_checked": [
          "observation.state"
        ]
      }
    },
    {
      "id": "constant_sequence",
      "category": "integrity",
      "status": "pass",
      "score": 100.0,
      "summary": "0/10 episodes freeze a normally-variable state channel",
      "flagged_episodes": [],
      "metrics": {}
    }
  ],
  "flagged_episodes": [
    0,
    1,
    2,
    3,
    4,
    7,
    8,
    9
  ],
  "warnings": [
    "velocity_spike used finite-differenced state"
  ],
  "error": null
}